label;English;English (Europe);German;Spanish;Spanish (US);French;French (US);Italian;Dutch;Chinese;Chinese (Traditional);Japanese;Korean;Russian
InsectToy_05922;saw stag model;saw stag model;Sägez.-Hirschkäfermodell;figura esc. ciervo sierra;figura esc. ciervo sierra;modèle de lucane inclinatus;modèle de lucane inclinatus;replica di coleottero cervo;modelzaaghertkever;锯锹形虫模型;鋸鍬形蟲模型;ノコギリクワガタのもけい;톱사슴벌레 모형;модель жука-оленя
InsectToy_05924;grand h. hercules model;grand h. hercules model;Mega-Herkuleskäf.-Modell;estatua es. astado hércules;estatua es. astado hércules;modèle du Roi Dynaste;modèle du Roi Dynaste;replica XL scarabeo Ercole;modelherculeskever XL;巨大兜虫模型;巨大獨角仙模型;おおいなるカブトのもけい;위대한 장수풍뎅이 모형;модель жука-геркулеса
InsectToy_05927;wasp model;wasp model;Wespenmodell;figura de avispa;figura de avispa;modèle de guêpe;modèle de guêpe;replica di vespa;modelwesp;黄蜂模型;黃蜂模型;ハチのもけい;벌 모형;модель осы
InsectToy_05928;honeybee model;honeybee model;Honigbienenmodell;figura de abeja melífera;figura de abeja melífera;modèle d'abeille naine;modèle d'abeille naine;replica di ape operaia;modelhoningbij;蜜蜂模型;蜜蜂模型;ミツバチのもけい;꿀벌 모형;модель восковой пчелы
InsectToy_05929;scarab beetle model;scarab beetle model;Goldskarabäusmodell;figura de escarabajo oro;figura de escarabajo oro;modèle de scarabée;modèle de scarabée;replica di chrysina resplen.;modelscarabee;宝石金龟模型;寶石金龜模型;プラチナコガネのもけい;보석풍뎅이 모형;модель золотого скарабея
InsectToy_05935;flea model;flea model;Flohmodell;figura de pulga;figura de pulga;modèle de puce;modèle de puce;replica di pulce;modelvlo;跳蚤模型;跳蚤模型;ノミのもけい;벼룩 모형;модель блохи
InsectToy_05936;mosquito model;mosquito model;Mückenmodell;figura de mosquito;figura de mosquito;modèle de moustique;modèle de moustique;replica di zanzara;modelmug;蚊子模型;蚊子模型;カのもけい;모기 모형;модель комара
InsectToy_05938;horned dynastid model;horned dynastid model;Nashornkäfermodell;figura esc. astado japonés;figura esc. astado japonés;modèle de scarabée kabuto;modèle de scarabée kabuto;replica scarab. kabutomushi;modelneushoornkever;独角仙模型;獨角仙模型;カブトムシのもけい;장수풍뎅이 모형;модель дупляка
InsectToy_05944;tiger butterfly model;tiger butterfly model;Schwalbenschwanzmodell;figura de mariposa tigre;figura de mariposa tigre;modèle de machaon;modèle de machaon;replica di farfalla tigre;modelkoninginnenpage;凤蝶模型;鳳蝶模型;アゲハチョウのもけい;호랑나비 모형;модель махаона
InsectToy_07046;brown cicada model;brown cicada model;Braunzikadenmodell;figura de cigarra marrón;figura de cigarra marrón;modèle de cigale cercope;modèle de cigale cercope;replica di cicala marrone;model-bruine-cicade;油蝉模型;油蟬模型;アブラゼミのもけい;유지매미 모형;модель коричнев. цикады
InsectToy_07049;R. Brooke's birdwing model;R. Brooke's birdwing model;Troides-brookiana-Modell;figura mariposa alas Brooke;figura mariposa alas Brooke;modèle troides brookiana;modèle troides brookiana;replica farfalla Raja Brooke;model-Rajah-Brooke-vlinder;红颈凤蝶模型;紅頸鳳蝶模型;アカエリトリバネアゲハのもけい;붉은목도리비단나비 모형;модель трогоноптеры Бр.
InsectToy_07050;red dragonfly model;red dragonfly model;Feuerlibellenmodell;figura de libélula roja;figura de libélula roja;modèle de sympetrum;modèle de libellule rouge;replica di libellula rossa;model-rode-libel;红蜻蜓模型;紅蜻蜓模型;アキアカネのもけい;고추잠자리 모형;модель красной стрекозы
InsectToy_07051;grand Q. A. birdwing model;grand Q. A. birdwing model;Mega-Vogelfaltermodell;estatua marip. alas pájaro;estatua marip. alas pájaro;modèle du Roi Papillon;modèle du Roi Papillon;replica XL farfalla regina A.;model-A.-vogelvlinder XL;巨大蝴蝶模型;巨大蝴蝶模型;おおいなるチョウのもけい;위대한 나비 모형;модель птицекрылки Ал.
InsectToy_07052;pondskater model;pondskater model;Wasserläufermodell;figura de zapatero;figura de zapatero;modèle de patineur;modèle de patineur;replica di gerride;modelschaatsenrijder;水黾模型;水黽模型;アメンボのもけい;소금쟁이 모형;модель водомерки
InsectToy_07053;ant model;ant model;Ameisenmodell;figura de hormiga;figura de hormiga;modèle de fourmi;modèle de fourmi;replica di formica;modelmier;蚂蚁模型;螞蟻模型;アリのもけい;개미 모형;модель муравья
InsectToy_07054;pill bug model;pill bug model;Kugelasselmodell;figura de cochinilla;figura de cochinilla;modèle de cloporte;modèle de cloporte;replica di porcellino di terra;modelpissebed;鼠妇模型;鼠婦模型;ダンゴムシのもけい;공벌레 모형;модель мокрицы
InsectToy_07055;wharf roach model;wharf roach model;Ligia-exotica-Modell;figura cochinilla de arena;figura cochinilla de arena;modèle de ligie;modèle de ligie;replica di ligia exotica;modelstrandpissebed;海蟑螂模型;海蟑螂模型;フナムシのもけい;갯강구 모형;модель морского таракана
InsectToy_07056;moth model;moth model;Mottenmodell;figura de polilla;figura de polilla;modèle de papillon de nuit;modèle de papillon de nuit;replica di falena;modelmot;飞蛾模型;飛蛾模型;ガのもけい;나방 모형;модель павлиноглазки
InsectToy_07057;diving beetle model;diving beetle model;Schwimmkäfermodell;figura escarabajo nadador;figura escarabajo nadador;modèle de dytique;modèle de dytique;replica di ditisco;modelwaterroofkever;龙虱模型;龍蝨模型;ゲンゴロウのもけい;물방개 모형;модель плавунца
InsectToy_07058;darner dragonfly model;darner dragonfly model;Königslibellenmodell;figura libélula cab. diablo;figura libélula cab. diablo;modèle d'anax napolitain;modèle d'anax napolitain;replica di libellula depressa;model-zuidelijke-keizerlibel;绿胸晏蜓模型;綠胸晏蜓模型;ギンヤンマのもけい;왕잠자리 모형;модель дозорщика
InsectToy_07059;grand goliath beetle model;grand goliath beetle model;Mega-Goliathkäfermodell;estatua de goliat;estatua de goliat;modèle du Roi Scarabée;modèle du Roi Scarabée;replica XL scarabeo Golia;modelgoliathkever XL;巨大花金龟模型;巨大花金龜模型;おおいなるハナムグリのもけい;위대한 꽃무지 모형;модель жука-голиафа
InsectToy_07060;fly model;fly model;Fliegenmodell;figura de mosca;figura de mosca;modèle de mouche;modèle de mouche;replica di mosca;modelvlieg;苍蝇模型;蒼蠅模型;ハエのもけい;파리 모형;модель мухи
InsectToy_07061;orchid mantis model;orchid mantis model;Orchideenmantismodell;figura de mantis orquídea;figura de mantis orquídea;modèle de mante orchidée;modèle de mante orchidée;replica di mantide orchidea;model-orch.-bidsprinkhaan;兰花螳螂模型;蘭花螳螂模型;ハナカマキリのもけい;연꽃사마귀 모형;модель орхид. богомола
InsectToy_07062;tiger beetle model;tiger beetle model;Sandlaufkäfermodell;figura de escarabajo tigre;figura de escarabajo tigre;modèle de cicindèle;modèle de cicindèle;replica di cicindela;modelzandloopkever;虎甲虫模型;虎甲蟲模型;ハンミョウのもけい;길앞잡이 모형;модель жука-скакуна
InsectToy_07063;evening cicada model;evening cicada model;Abendzikadenmodell;figura de cigarrilla;figura de cigarra;modèle de cigale higurashi;modèle de cigale higurashi;replica di cicala notturna;modelavondcicade;暮蝉模型;暮蟬模型;ヒグラシのもけい;쓰르라미 모형;модель ночной цикады
InsectToy_07064;cyclommatus stag model;cyclommatus stag model;Cyclommatusmodell;figura esc. cyclommatus;figura esc. cyclommatus;modèle lucane cyclommatus;modèle lucane cyclommatus;replica di col. cyclommatus;model-vliegend-hert;细身赤锹形虫模型;細身赤鍬形蟲模型;ホソアカクワガタのもけい;엘라푸스가위사슴벌레 모형;модель жука-рогача
InsectToy_07065;firefly model;firefly model;Leuchtkäfermodell;figura de luciérnaga;figura de luciérnaga;modèle de luciole;modèle de luciole;replica di lucciola;modelvuurvliegje;萤火虫模型;螢火蟲模型;ホタルのもけい;반디 모형;модель светлячка
InsectToy_07066;dung beetle model;dung beetle model;Mistkäfermodell;figura escarabajo pelotero;figura escarabajo pelotero;modèle de bousier;modèle de bousier;replica scarabeo stercorario;modelmestkever;蜣螂模型;糞金龜模型;フンコロガシのもけい;쇠똥구리 모형;модель жука-навозника
InsectToy_07067;rice grasshopper model;rice grasshopper model;Heuschreckenmodell;figura de langosta;figura de langosta;modèle de criquet;modèle de criquet;replica di locusta;modelrijstsprinkhaan;稻蝗模型;稻蝗模型;イナゴのもけい;메뚜기 모형;модель рисовой кобылки
InsectToy_07068;mantis model;mantis model;Gottesanbeterinnenmodell;figura de mantis religiosa;figura de mantis religiosa;modèle de mante religieuse;modèle de mante religieuse;replica di mantide;modelbidsprinkhaan;螳螂模型;螳螂模型;カマキリのもけい;사마귀 모형;модель богомола
InsectToy_07069;stinkbug model;stinkbug model;Stinkwanzenmodell;figura de chinche;figura de chinche;modèle de punaise;modèle de punaise;replica di cimice;modelschildwants;椿象模型;椿象模型;カメムシのもけい;노린재 모형;модель щитника
InsectToy_07070;citrus long-horned b. model;citrus long-horned b. model;Fichtenbockmodell;figura longicornio asiático;figura longicornio asiático;modèle de capricorne;mod. capric. des agrumes;replica di tarlo asiatico;model-Aziatische-boktor;星天牛模型;星天牛模型;ゴマダラカミキリのもけい;알락하늘소 모형;модель цитрусового усача
InsectToy_07071;peacock butterfly model;peacock butterfly model;Ritterfaltermodell;figura de mariposa bianor;figura de mariposa bianor;modèle de papilio bianor;modèle de papilio bianor;replica di farfalla vanessa io;modelpauwenpage;乌鸦凤蝶模型;烏鴉鳳蝶模型;カラスアゲハのもけい;제비나비 모형;модель бианора
InsectToy_07072;snail model;snail model;Schneckenmodell;figura de caracol;figura de caracol;modèle d'escargot;modèle d'escargot;replica di chiocciola;modelslak;蜗牛模型;蝸牛模型;カタツムリのもけい;달팽이 모형;модель улитки
InsectToy_07073;grasshopper model;grasshopper model;Grashüpfermodell;figura de saltamontes;figura de saltamontes;modèle de sauterelle;modèle de sauterelle;replica di cavalletta;modelsprinkhaan;蚱蜢模型;蚱蜢模型;キリギリスのもけい;여치 모형;модель кузнечика
InsectToy_07074;earth-boring dung b. model;earth-boring dung b. model;Gold-Mistkäfermodell;figura escarab. geotrúpido;figura escarab. geotrúpido;modèle de geotrupidae;modèle de géotrupe;replica di geotrupidae;model-echte-mestkever;雪隐金龟模型;雪隱金龜模型;オオセンチコガネのもけい;보라금풍뎅이 모형;модель навозника-землер.
InsectToy_07075;horned atlas model;horned atlas model;Atlaskäfermodell;figura esc. astado atlas;figura esc. astado atlas;modèle de scarabée Atlas;modèle de scarabée Atlas;replica di scarabeo atlas;modelatlaskever;高卡萨斯南洋大兜虫模型;高卡薩斯南洋大兜蟲模型;コーカサスオオカブトのもけい;코카서스장수풍뎅이 모형;модель жука-атласа
InsectToy_07076;walking leaf model;walking leaf model;Blattschreckenmodell;figura de insecto hoja;figura de insecto hoja;modèle de phyllie;modèle de phyllie;replica di insetto foglia;model-wandelend-blad;叶竹节虫模型;葉竹節蟲模型;コノハムシのもけい;잎사귀벌레 모형;модель листотела
InsectToy_07077;cricket model;cricket model;Grillenmodell;figura de grillo común;figura de grillo común;modèle de grillon des prés;modèle de grillon des prés;replica di grillo;modelkrekel;蟋蟀模型;蟋蟀模型;コオロギのもけい;귀뚜라미 모형;модель сверчка
InsectToy_07078;giant cicada model;giant cicada model;Riesenzikadenmodell;figura de cigarra gigante;figura de cigarra gigante;modèle de cigale géante;modèle de cigale géante;replica di cicala gigante;modelreuzencicade;熊蝉模型;熊蟬模型;クマゼミのもけい;곰매미 모형;модель гигантской цикады
InsectToy_07079;spider model;spider model;Spinnenmodell;figura de araña;figura de araña;modèle d'araignée;modèle d'araignée;replica di ragno;modelspin;蜘蛛模型;蜘蛛模型;クモのもけい;거미 모형;модель паука
InsectToy_07080;agrias butterfly model;agrias butterfly model;Agrias-Faltermodell;figura de mariposa narciso;figura de mariposa narciso;modèle d'agrias;modèle d'agrias;replica di farfalla agrias;modelagriasvlinder;彩袄蛱蝶模型;彩襖蛺蝶模型;ミイロタテハのもけい;아그리아스나비 모형;модель агриаса клаудина
InsectToy_07081;robust cicada model;robust cicada model;Hyalessa-Zikadenmodell;figura de cigarra oriental;figura de cigarra oriental;modèle de cigale hyalessa;modèle de cigale hyalessa;replica di cicala robusta;model-minmin-cicade;斑透翅蝉模型;斑透翅蟬模型;ミンミンゼミのもけい;참매미 모형;модель певчей цикады
InsectToy_07082;bagworm model;bagworm model;Sackträgermodell;figura de oruga de bolsón;figura de oruga de bolsón;modèle de psyché;modèle de psyché;replica di bruco dal fodero;modelzakjesdrager;蓑衣虫模型;蓑衣蟲模型;ミノムシのもけい;도롱이벌레 모형;модель мешочницы
InsectToy_07083;miyama stag model;miyama stag model;Hirschkäfermodell;figura esc. ciervo Miyama;figura esc. ciervo Miyama;modèle de lucane miyama;modèle de lucane miyama;replica coleottero lucanide;model-Miyama-hertkever;深山锹形虫模型;深山鍬形蟲模型;ミヤマクワガタのもけい;사슴벌레 모형;модель горн. жука-оленя
InsectToy_07084;yellow butterfly model;yellow butterfly model;Zitronenfaltermodell;figura de mariposa colias;figura de mariposa colias;modèle de citrin;modèle de citrin;replica di farfalla gialla;modelcitroenvlinder;斑缘点粉蝶模型;斑緣點粉蝶模型;モンキチョウのもけい;노랑나비 모형;модель желтушки
InsectToy_07085;common butterfly model;common butterfly model;Kohlweißlingmodell;figura de mariposa común;figura de mariposa común;modèle de piéride;modèle piéride de la rave;replica di farfalla comune;modelkoolwitje;白粉蝶模型;白粉蝶模型;モンシロチョウのもけい;배추흰나비 모형;модель белянки
InsectToy_07086;emperor butterfly model;emperor butterfly model;Himmelsfaltermodell;figura de mariposa celeste;figura de mariposa celeste;modèle de morpho bleu;modèle de morpho bleu;replica di farfalla morfo blu;model-blauwe-morpho;大蓝闪蝶模型;大藍閃蝶模型;モルフォチョウのもけい;몰포나비 모형;модель морфо менелая
InsectToy_07087;walking stick model;walking stick model;Stabschreckenmodell;figura de insecto palo;figura de insecto palo;modèle de phasme;modèle de phasme;replica di insetto stecco;model-wandelende-tak;竹节虫模型;竹節蟲模型;ナナフシのもけい;긴수염대벌레 모형;модель палочника
InsectToy_07088;rainbow stag model;rainbow stag model;Pracht-Hirschkäfermodell;figura esc. ciervo arcoíris;figura esc. ciervo arcoíris;modèle de lucane copris;modèle de lucane copris;replica di col. arcobaleno;modelregenbooghertkever;彩虹锹形虫模型;彩虹鍬形蟲模型;ニジイロクワガタのもけい;뮤엘러리사슴벌레 모형;модель радуж. жука-оленя
InsectToy_07089;mole cricket model;mole cricket model;Maulwurfsgrillenmodell;figura de grillo cebollero;figura de grillo cebollero;modèle de taupe-grillon;modèle de taupe-grillon;replica di grillotalpa;modelveenmol;蝼蛄模型;螻蛄模型;オケラのもけい;땅강아지 모형;модель медведки
InsectToy_07090;grand b. dragonfly model;grand b. dragonfly model;Mega-Quelljungfermodell;estatua de libélula tigre;estatua de libélula tigre;modèle de la Reine Libellule;modèle de la Reine Libellule;replica XL di libellula striata;modelbronlibel XL;巨大蜻蜓模型;巨大蜻蜓模型;おおいなるトンボのもけい;위대한 잠자리 모형;модель кордулегастера
InsectToy_07091;monarch butterfly model;monarch butterfly model;Monarchfaltermodell;figura de mariposa monarca;figura de mariposa monarca;modèle de monarque;modèle de monarque;replica di farfalla monarca;modelmonarchvlinder;大桦斑蝶模型;大樺斑蝶模型;オオカバマダラのもけい;왕나비 모형;модель монарха
InsectToy_07092;giant stag model;giant stag model;Riesen-Hirschkäfermodell;figura esc. ciervo gigante;figura esc. ciervo gigante;modèle lucane cerf-volant;modèle lucane cerf-volant;replica coleottero gigante;modelreuzenhertkever;大锹形虫模型;大鍬形蟲模型;オオクワガタのもけい;왕사슴벌레 모형;модель гигант. жука-оленя
InsectToy_07093;golden stag model;golden stag model;Allotopus-rosenb.-Modell;figura esc. ciervo tornasol;figura esc. ciervo tornasol;modèle de lucane lamprima;modèle de lucane lamprima;replica di coleottero dorato;model-gouden-hertkever;黄金鬼锹形虫模型;黃金鬼鍬形蟲模型;オウゴンオニクワガタのもけい;황금사슴벌레 모형;модель лампримы
InsectToy_07094;scorpion model;scorpion model;Skorpionmodell;figura de escorpión;figura de escorpión;modèle de scorpion;modèle de scorpion;replica di scorpione;modelschorpioen;蝎子模型;蠍子模型;サソリのもけい;전갈 모형;модель скорпиона
InsectToy_07095;cicada shell model;cicada shell model;Zikadenlarvenhautmodell;figura de muda de cigarra;figura de carcasa de cigarra;modèle de mue de cigale;modèle de mue de cigale;replica di esuvia di cicala;modelcicadehuid;蝉蜕模型;蟬蛻模型;セミのぬけがらのもけい;매미 허물 모형;модель кокона цикады
InsectToy_07096;bell cricket model;bell cricket model;Singgrillenmodell;figura de grillo campana;figura de grillo campana;modèle de grillon du Midi;modèle de grillon du Midi;replica di suzumushi;modelbelkrekel;铃虫模型;鈴蟲模型;スズムシのもけい;방울벌레 모형;модель домашнего сверчка
InsectToy_07097;long locust model;long locust model;Nasenschreckenmodell;figura de langosta alargada;figura de langosta alargada;modèle d'acrida cinerea;modèle d'acrida cinerea;replica di acrida cinerea;modelveldsprinkhaan;中华剑角蝗模型;中華劍角蝗模型;ショウリョウバッタのもけい;방아깨비 모형;модель акриды
InsectToy_07099;jewel beetle model;jewel beetle model;Prachtkäfermodell;figura de escarabajo joya;figura de escarabajo joya;modèle de bupreste;modèle de bupreste;replica di stigmodera;modelprachtkever;吉丁虫模型;吉丁蟲模型;タマムシのもけい;비단벌레 모형;модель златки
InsectToy_07101;tarantula model;tarantula model;Vogelspinnenmodell;figura de tarántula;figura de tarántula;modèle de tarentule;modèle de tarentule;replica di tarantola;modelvogelspin;狼蛛模型;狼蛛模型;タランチュラのもけい;타란툴라 모형;модель паука-птицееда
InsectToy_07102;ladybug model;ladybug model;Marienkäfermodell;figura de mariquita;figura de catarina;modèle de coccinelle;modèle de coccinelle;replica di coccinella;modellieveheersbeestje;瓢虫模型;瓢蟲模型;テントウムシのもけい;무당벌레 모형;модель божьей коровки
InsectToy_07103;migratory locust model;migratory locust model;Wanderschreckenmodell;figura langosta migratoria;figura langosta migratoria;modèle de criquet pèlerin;modèle de criquet pèlerin;replica di locusta migratoria;modeltreksprinkhaan;飞蝗模型;飛蝗模型;トノサマバッタのもけい;섬풀무치 모형;модель перелетн. саранчи
InsectToy_07104;walker cicada model;walker cicada model;Bergzikadenmodell;figura de cigarra común;figura de cigarra común;modèle de cigale cicadelle;modèle de cigale cicadelle;replica di cicala sputacchina;modelbergcicade;寒蝉模型;寒蟬模型;ツクツクホウシのもけい;애매미 모형;модель горной цикады
InsectToy_07105;violin beetle model;violin beetle model;Geigenkäfermodell;figura de escarabajo violín;figura de escarabajo violín;modèle de mormolyce;modèle de mormolyce;replica di carabo violino;modelvioolkever;提琴虫模型;提琴蟲模型;バイオリンムシのもけい;바이올린벌레 모형;модель жужелицы
InsectToy_07108;hermit crab model;hermit crab model;Einsiedlerkrebsmodell;figura de cangrejo ermitaño;figura de cangrejo ermitaño;modèle de bernard-l'ermite;modèle de bernard-l'ermite;replica di granchio paguro;modelheremietkreeft;寄居蟹模型;寄居蟹模型;ヤドカリのもけい;소라게 모형;модель рака-отшельника
InsectToy_07109;grand Atlas moth model;grand Atlas moth model;Mega-Atlasspinnermodell;estatua de polilla atlas;estatua de polilla atlas;modèle Roi Papillon de nuit;modèle Roi Papillon de nuit;replica XL di farfalla cobra;modelatlasvlinder XL;巨大飞蛾模型;巨大飛蛾模型;おおいなるガのもけい;위대한 나방 모형;модель павлиноглазки атл.
InsectToy_07110;horned elephant model;horned elephant model;Elefantenkäfermodell;figura esc. astado elefante;figura esc. astado elefante;modèle scarabée éléphant;modèle scarabée éléphant;replica di scarabeo elefante;modelolifantkever;象兜虫模型;象兜蟲模型;ゾウカブトのもけい;코끼리장수풍뎅이 모형;модель жука-слона
InsectToy_07111;common bluebottle model;common bluebottle model;Kolibrifaltermodell;figura marip. triángulo azul;figura marip. triángulo azul;modèle graphium sarpedon;modèle graphium sarpedon;replica graphium sarpedon;model-blauwe-driehoek;青带凤蝶模型;青帶鳳蝶模型;アオスジアゲハのもけい;청띠제비나비 모형;модель графиума сарпед.
InsectToy_07112;paper kite butterfly model;paper kite butterfly model;Weiße-Baumnym.-Modell;figura marip. cometa papel;figura marip. cometa papel;modèle de grand planeur;modèle de grand planeur;replica farfalla carta di riso;modelpapiervlinder;大白斑蝶模型;大白斑蝶模型;オオゴマダラのもけい;왕얼룩나비 모형;модель идеи левконоя
InsectToy_07113;great purple emperor model;great purple emperor model;Japan-Schillerfaltermodell;figura marip. emp. japonés;figura marip. emp. japonés;modèle de sasakia charonda;mod. gr. empereur pourpre;replica farfalla imper. viola;model-paarse-keizervlinder;大紫蛱蝶模型;大紫蛺蝶模型;オオムラサキのもけい;왕오색나비 모형;модель сасакии харонды
InsectToy_07114;drone beetle model;drone beetle model;Japan-Rosenkäfermodell;figura esc. verde japonés;figura esc. verde japonés;modèle pseudotorynorrhina;modèle de cétoine dorée;replica di cetonia dorata;modelbladsprietkever;日铜锣花金龟模型;日銅鑼花金龜模型;カナブンのもけい;풍이 모형;модель бронзовки
InsectToy_07115;grand giraffe stag model;grand giraffe stag model;Mega-Giraffenhk.-Modell;estatua esc. ciervo jirafa;estatua esc. ciervo jirafa;modèle du Roi Lucane;modèle du Roi Lucane;replica XL coleottero giraffa;modelgirafhertkever XL;巨大锹形虫模型;巨大鍬形蟲模型;おおいなるクワガタのもけい;위대한 사슴벌레 모형;модель рогача-жирафа
InsectToy_07116;man-faced stink bug model;man-faced stink bug model;Gesichtswanzenmodell;figura chinche rost. humano;figura chinche rost. humano;modèle de catacanthus;modèle de catacanthus;replica di catacanthus;modelgezichtschildwants;人面椿象模型;人面椿象模型;ジンメンカメムシのもけい;인면노린재 모형;модель щитника с лицом
InsectToy_07117;M. sunset moth model;M. sunset moth model;Regenbogenfaltermodell;figura de polilla crepuscular;figura de polilla crepuscular;modèle chrysiridia rhipheus;modèle d'adriandolo;repl. urania del Madagascar;modeladriandolo;日落蛾模型;日落蛾模型;ニシキオオツバメガのもけい;마다가스카르비단제비나방 모형;модель урании мадагаск.
InsectToy_07118;blue weevil beetle model;blue weevil beetle model;Blaurüsselkäfermodell;figura de gorgojo azul;figura de gorgojo azul;modèle de charançon bleu;modèle de charançon bleu;repl. coleottero Schoenherr;model-blauwe-snuitkever;宝石象鼻虫模型;寶石象鼻蟲模型;ホウセキゾウムシのもけい;유포루스바구미 모형;модель син. долгоносика
